{
  "id": "features",
  "name": "Core Features",
  "category": "prd",
  "template": "Based on this project description:\n\n{{description}}\n\nGenerate 5-8 core features for an MVP. For each feature, provide:\n\n{\n  \"features\": [\n    {\n      \"name\": \"Feature name\",\n      \"what\": \"What does this feature do?\",\n      \"why\": \"Why is this important for the MVP?\",\n      \"how\": \"High-level approach for implementation\",\n      \"dependsOn\": [\"List of feature names this depends on\"],\n      \"enables\": [\"List of features this unlocks\"],\n      \"buildPhase\": 1-3 (1=foundation, 2=visible, 3=enhancement),\n      \"isVisible\": true/false (does this give users something to see/use?)\n    }\n  ]\n}\n\nFocus on:\n1. Foundation features that must be built first\n2. Visible features that users can interact with quickly\n3. Enhancement features that build on the foundation\n\nEnsure dependencies are logical and create a clear build order.",
  "parameters": ["description"],
  "outputSchema": {
    "features": [
      {
        "name": "string",
        "what": "string",
        "why": "string",
        "how": "string",
        "dependsOn": ["string"],
        "enables": ["string"],
        "buildPhase": "number",
        "isVisible": "boolean"
      }
    ]
  },
  "metadata": {
    "version": "1.0.0",
    "lastModified": "2025-10-30",
    "description": "Generate core features section with dependencies"
  }
}
